{
 "agf_version": "1.0",
 "project": {
  "id": "prj_minuta-acuerdos-del-equipo-de-registro-d",
  "name": "Minuta: acuerdos del equipo de registro (documento ficticio)"
 },
 "profile": "default",
 "sources": [
  {
   "id": "src_minuta-acuerdos-del-equipo-de-registro-d",
   "name": "minuta_registro.md",
   "sha256": "462aee46bdf6160ec3c063ccad95bb4a75fe75047ca1443120c2557a4abe3721",
   "facets": {
    "source_type": "diccionario"
   },
   "adapter": "markdown@1.0",
   "ingested_at": "2026-09-22T15:59:18+00:00",
   "status": "proposed",
   "title": "Minuta: acuerdos del equipo de registro (documento ficticio)",
   "unparsed": [],
   "unparsed_count": 0,
   "personal_data_guard": {
    "hits": {
     "rut_chileno": 0,
     "email": 0,
     "telefono_cl": 0,
     "fecha_con_nombre": 0
    },
    "confirmed_by_user": false
   }
  }
 ],
 "nodes": [
  {
   "id": "root",
   "kind": "project_root",
   "name": "Minuta: acuerdos del equipo de registro (documento ficticio)",
   "source_id": "src_minuta-acuerdos-del-equipo-de-registro-d",
   "origin": "inferred",
   "status": "proposed",
   "confidence": 0.6,
   "rationale": "Nombre de la raíz propuesto desde el título del documento; confirmar (decisión D6)."
  },
  {
   "id": "sec:src_minuta-acuerdos-del-equipo-de-registro-d:1",
   "kind": "section",
   "source_id": "src_minuta-acuerdos-del-equipo-de-registro-d",
   "name": "Decisiones sobre variables",
   "order": 1,
   "origin": "extracted",
   "status": "proposed",
   "confidence": 1.0,
   "provenance": {
    "locator": {
     "line": 5
    },
    "excerpt": "Decisiones sobre variables"
   },
   "number": 1
  },
  {
   "id": "el:fecha-de-emision-diagnostico",
   "kind": "element",
   "source_id": "src_minuta-acuerdos-del-equipo-de-registro-d",
   "parent_id": "sec:src_minuta-acuerdos-del-equipo-de-registro-d:1",
   "section_id": "sec:src_minuta-acuerdos-del-equipo-de-registro-d:1",
   "name": "Fecha de emisión diagnóstico",
   "facets": {
    "element_kind": "decision",
    "data_type": "fecha",
    "info_domain": "diagnostico",
    "sensitivity": "dato_sensible_salud"
   },
   "facet_origin": {
    "element_kind": "extracted",
    "data_type": "inferred",
    "info_domain": "inferred",
    "sensitivity": "inferred"
   },
   "facet_confidence": {
    "data_type": 0.8,
    "info_domain": 0.75,
    "sensitivity": 0.8
   },
   "facet_rationale": {
    "data_type": "regla fecha_prefix: empieza con «fecha»",
    "info_domain": "léxico del elemento: «diagnostic»",
    "sensitivity": "léxico «diagnost» (clasificación provisional, pendiente de revisión legal)"
   },
   "note": "se toma como fecha índice del caso; debe coincidir con `fecha_emision_dx` en la base [[Fecha de nacimiento]].",
   "origin": "extracted",
   "status": "proposed",
   "confidence": 1.0,
   "cardinality": "unknown",
   "required": null,
   "provenance": {
    "locator": {
     "line": 7
    },
    "excerpt": "Fecha de emisión diagnóstico: se toma como fecha índice del caso; debe coincidir con `fecha_emision_dx` en la base [[Fecha de nacimiento]]."
   }
  },
  {
   "id": "el:estado-vital",
   "kind": "element",
   "source_id": "src_minuta-acuerdos-del-equipo-de-registro-d",
   "parent_id": "sec:src_minuta-acuerdos-del-equipo-de-registro-d:1",
   "section_id": "sec:src_minuta-acuerdos-del-equipo-de-registro-d:1",
   "name": "Estado Vital",
   "facets": {
    "element_kind": "decision",
    "data_type": "binario",
    "info_domain": "evolucion_desenlace",
    "sensitivity": "dato_sensible_salud"
   },
   "facet_origin": {
    "element_kind": "extracted",
    "data_type": "inferred",
    "info_domain": "inferred",
    "sensitivity": "inferred"
   },
   "facet_confidence": {
    "data_type": 0.8,
    "info_domain": 0.75,
    "sensitivity": 0.8
   },
   "facet_rationale": {
    "data_type": "regla binario_lexico: contiene «estado vital»",
    "info_domain": "léxico del elemento: «estado vital»",
    "sensitivity": "léxico «estado vital» (clasificación provisional, pendiente de revisión legal)"
   },
   "note": "se registrará como Vivo / Fallecido / Desconocido.",
   "origin": "extracted",
   "status": "proposed",
   "confidence": 1.0,
   "cardinality": "unknown",
   "required": null,
   "provenance": {
    "locator": {
     "line": 8
    },
    "excerpt": "Estado Vital: se registrará como Vivo / Fallecido / Desconocido."
   }
  },
  {
   "id": "el:causa-de-defuncion",
   "kind": "element",
   "source_id": "src_minuta-acuerdos-del-equipo-de-registro-d",
   "parent_id": "sec:src_minuta-acuerdos-del-equipo-de-registro-d:1",
   "section_id": "sec:src_minuta-acuerdos-del-equipo-de-registro-d:1",
   "name": "Causa de defunción",
   "facets": {
    "element_kind": "decision",
    "data_type": "categorica",
    "vocabulary": "cie10",
    "info_domain": "evolucion_desenlace",
    "sensitivity": "dato_sensible_salud"
   },
   "facet_origin": {
    "element_kind": "extracted",
    "data_type": "inferred",
    "vocabulary": "inferred",
    "info_domain": "inferred",
    "sensitivity": "inferred"
   },
   "facet_confidence": {
    "data_type": 0.5,
    "vocabulary": 0.75,
    "info_domain": 0.75,
    "sensitivity": 0.8
   },
   "facet_rationale": {
    "data_type": "sin patrón reconocido: valor por defecto",
    "vocabulary": "patrón «causa de defuncion» de CIE-10",
    "info_domain": "léxico del elemento: «defuncion»",
    "sensitivity": "léxico «defuncion» (clasificación provisional, pendiente de revisión legal)"
   },
   "note": "codificada con CIE-10, edición vigente.",
   "origin": "extracted",
   "status": "proposed",
   "confidence": 1.0,
   "cardinality": "unknown",
   "required": null,
   "provenance": {
    "locator": {
     "line": 9
    },
    "excerpt": "Causa de defunción: codificada con CIE-10, edición vigente."
   }
  },
  {
   "id": "el:ki-67",
   "kind": "element",
   "source_id": "src_minuta-acuerdos-del-equipo-de-registro-d",
   "parent_id": "sec:src_minuta-acuerdos-del-equipo-de-registro-d:1",
   "section_id": "sec:src_minuta-acuerdos-del-equipo-de-registro-d:1",
   "name": "Ki-67",
   "facets": {
    "element_kind": "decision",
    "data_type": "numerica",
    "info_domain": "biomarcadores_laboratorio",
    "sensitivity": "dato_sensible_salud"
   },
   "facet_origin": {
    "element_kind": "extracted",
    "data_type": "inferred",
    "info_domain": "inferred",
    "sensitivity": "inferred"
   },
   "facet_confidence": {
    "data_type": 0.8,
    "info_domain": 0.75,
    "sensitivity": 0.8
   },
   "facet_rationale": {
    "data_type": "regla numerica: contiene «ki-67»",
    "info_domain": "léxico del elemento: «ki-67»",
    "sensitivity": "léxico «ki-67» (clasificación provisional, pendiente de revisión legal)"
   },
   "note": "porcentaje de células positivas, entero de 0 a 100.",
   "origin": "extracted",
   "status": "proposed",
   "confidence": 1.0,
   "cardinality": "unknown",
   "required": null,
   "provenance": {
    "locator": {
     "line": 10
    },
    "excerpt": "Ki-67: porcentaje de células positivas, entero de 0 a 100."
   }
  },
  {
   "id": "sec:src_minuta-acuerdos-del-equipo-de-registro-d:2",
   "kind": "section",
   "source_id": "src_minuta-acuerdos-del-equipo-de-registro-d",
   "name": "Tareas",
   "order": 2,
   "origin": "extracted",
   "status": "proposed",
   "confidence": 1.0,
   "provenance": {
    "locator": {
     "line": 12
    },
    "excerpt": "Tareas"
   },
   "number": 2
  },
  {
   "id": "el:definir-cardinalidad-de-comites-y-tratamientos",
   "kind": "element",
   "source_id": "src_minuta-acuerdos-del-equipo-de-registro-d",
   "parent_id": "sec:src_minuta-acuerdos-del-equipo-de-registro-d:2",
   "section_id": "sec:src_minuta-acuerdos-del-equipo-de-registro-d:2",
   "name": "Definir cardinalidad de comités y tratamientos",
   "facets": {
    "element_kind": "task",
    "data_type": "categorica",
    "info_domain": "tratamiento",
    "sensitivity": "dato_sensible_salud"
   },
   "facet_origin": {
    "element_kind": "extracted",
    "data_type": "inferred",
    "info_domain": "inferred",
    "sensitivity": "inferred"
   },
   "facet_confidence": {
    "data_type": 0.5,
    "info_domain": 0.75,
    "sensitivity": 0.8
   },
   "facet_rationale": {
    "data_type": "sin patrón reconocido: valor por defecto",
    "info_domain": "léxico del elemento: «tratamiento»",
    "sensitivity": "léxico «tratamiento» (clasificación provisional, pendiente de revisión legal)"
   },
   "note": "pendiente, responsable equipo de registro.",
   "origin": "extracted",
   "status": "proposed",
   "confidence": 1.0,
   "cardinality": "unknown",
   "required": null,
   "provenance": {
    "locator": {
     "line": 14
    },
    "excerpt": "Definir cardinalidad de comités y tratamientos: pendiente, responsable equipo de registro."
   }
  },
  {
   "id": "el:completar-dominios-de-valores-de-las-variables-categoricas",
   "kind": "element",
   "source_id": "src_minuta-acuerdos-del-equipo-de-registro-d",
   "parent_id": "sec:src_minuta-acuerdos-del-equipo-de-registro-d:2",
   "section_id": "sec:src_minuta-acuerdos-del-equipo-de-registro-d:2",
   "name": "Completar dominios de valores de las variables categóricas.",
   "facets": {
    "element_kind": "task",
    "data_type": "categorica",
    "info_domain": "financiero"
   },
   "facet_origin": {
    "element_kind": "extracted",
    "data_type": "inferred",
    "info_domain": "inferred"
   },
   "facet_confidence": {
    "data_type": 0.5,
    "info_domain": 0.75
   },
   "facet_rationale": {
    "data_type": "sin patrón reconocido: valor por defecto",
    "info_domain": "léxico del elemento: «valor»"
   },
   "note": null,
   "origin": "extracted",
   "status": "proposed",
   "confidence": 1.0,
   "cardinality": "unknown",
   "required": null,
   "provenance": {
    "locator": {
     "line": 15
    },
    "excerpt": "Completar dominios de valores de las variables categóricas."
   }
  },
  {
   "id": "sec:src_minuta-acuerdos-del-equipo-de-registro-d:3",
   "kind": "section",